relation_id,user_id,object1_id,object2_id,equivalence_id,value,explanation
494,1,137,156,4,False,"""Social science is typically studied through integrative methods involving human interaction and theoretical frameworks, whereas kmeans clustering is a computational algorithmic process. They are not physically interchangeable and do not represent the same implementation."""
495,0,26,28,2,False,"""A quorum represents the minimum number of members needed to conduct business, while hard consensus is a decision-making process that emphasizes unanimity. Although both relate to decision-making, they serve different primary functions and cannot be considered functionally equivalent."""
496,0,272,144,1,False,"""Trade-off analysis is a decision-making process that emphasizes analyzing the costs and benefits of decisions, whereas cybernetics is a field that studies systems and control. They express distinct concepts and cannot be substituted in a conceptual architecture without changing the meaning."""
497,0,272,144,2,False,"""Trade-off analysis serves to evaluate the costs and benefits of decisions, whereas cybernetics studies the control and communication in the animal and the machine. They perform different functions."""
498,0,272,144,3,False,"""The methods and procedures in trade-off analysis (systematic cost-benefit evaluation) differ significantly from those in cybernetics (feedback loops, control mechanisms). They are not logically equivalent."""
499,0,272,144,4,False,"""Trade-off analysis is a specific decision-making process, whereas cybernetics is a broad academic field. They are not physically interchangeable."""
500,1,198,138,1,False,"""Secondary rules refer to meta-rules governing how other rules are created, which is conceptually different from computer science, a field that studies computation."""
501,1,198,138,2,False,"""Secondary rules perform the function of providing guidelines for rule-making, whereas computer science functions to analyze and develop computational systems. They serve different primary functions."""
502,1,198,138,3,False,"""The procedures involved in formulating secondary rules (meta-rule creation) are different from those involved in computer science (algorithm development, computational theories). They are not logically equivalent."""
503,1,198,138,4,False,"""Secondary rules are abstract and broader in scope, whereas computer science encompasses practical and theoretical approaches to computation. They are not physically interchangeable."""
504,99,254,49,1,False,"""A 'task force' is a group of people who work on a specific task, whereas a 'follower' is a person who follows a leader. These express different concepts and cannot be substituted in a conceptual architecture without changing the meaning."""
505,99,254,49,2,False,"""A 'task force' performs the function of completing specific tasks through collaboration, while a 'follower' performs the function of following the guidance of a leader. They serve different primary functions and are not functionally equivalent."""
506,99,254,49,3,False,"""The methods and procedures for organizing and operating a 'task force' (collaborative task completion) differ significantly from those for being a 'follower' (following leadership). They are not logically equivalent."""
507,99,254,49,4,False,"""A 'task force' consists of a collaborative group working on specific tasks, whereas a 'follower' is an individual who follows a leader. They are not physically interchangeable."""
508,1,10,273,1,False,"""Rough consensus and running code"" is a principle that emphasizes practical implementation and agreement, whereas ""robust optimization"" is a decision-making process aimed at making resilient decisions. They express different concepts."
509,1,10,273,2,False,"""Rough consensus and running code"" facilitates practical decision-making through consensus and implementation, while ""robust optimization"" focuses on decision resilience. They perform different functions."
510,1,10,273,3,False,The procedures and methods involved in achieving rough consensus and running code (gaining group consensus and emphasizing practical implementation) differ from those used in robust optimization (mathematical and computational techniques for decision-making). They are not logically equivalent.
511,1,10,273,4,False,"""Rough consensus and running code"" is a conceptual principle often used in governance and project management, whereas ""robust optimization"" involves specific technical processes and algorithms. They are not physically interchangeable."
512,1,187,170,1,False,"""The concept of 'code,' which is a set of rules or guidelines, is fundamentally different from 'evaluation,' which is the process of assessing performance. They express different concepts."""
513,1,187,170,2,False,"""The primary function of 'code' is to serve as rules or guidelines, whereas 'evaluation' functions to assess performance. They perform different functions."""
514,1,187,170,3,False,"""The procedures and methods for creating and implementing 'code' (formulating guidelines) are different from those for 'evaluation' (assessing performance). They are not logically equivalent."""
515,1,187,170,4,False,"""Physically, 'code' consists of documented guidelines, whereas 'evaluation' involves activities related to performance assessment. They are not physically interchangeable."""
516,999,197,84,2,True,"""Both 'parliamentary procedure' and 'decision-making method' perform the function of guiding how decisions are made in a structured context. Thus, they can be considered functionally equivalent in a functional architecture."""
517,1,78,104,1,False,"""An attribute is a characteristic of an object, whereas strategies are plans for achieving goals. They express different concepts."""
518,1,158,138,1,False,"The concept of 'sum,' which is a mathematical operation adding numbers, is fundamentally different from 'computer science,' a field that studies computation. They express distinct concepts."
519,1,158,138,2,False,"The primary function of 'sum' is to add numbers, whereas 'computer science' functions to study and develop computational systems. They perform different primary functions."
520,1,158,138,3,False,The methods and procedures for performing a 'sum' (adding numbers) differ from those involved in computational analysis and development in 'computer science.' They are not logically equivalent.
521,1,158,138,4,False,"Physically, 'sum' is a mathematical operation, whereas 'computer science' encompasses theoretical and practical approaches in the field of computation. They are not physically interchangeable."
522,999,127,2,1,False,"""An 'open-loop system' is a system that operates without feedback, which is fundamentally different from 'least squares regression,' a statistical method for estimating relationships. These express different concepts and are not substitutable in a conceptual architecture without changing the meaning."""
523,999,127,2,2,False,"""An 'open-loop system' performs the function of operating without feedback, while 'least squares regression' performs the function of estimating relationships in data. They serve different primary functions and are not functionally equivalent."""
524,999,127,2,3,False,"""The methods and procedures in an open-loop system (operating without feedback) differ significantly from those used in least squares regression (statistical calculations for relationship estimation). They are not logically equivalent."""
525,999,127,2,4,False,"""An 'open-loop system' is a type of control system, whereas 'least squares regression' is a statistical method. They are not physically interchangeable."""
526,0,212,188,1,False,"An 'address' is a reference for localizing an object, whereas 'computer code' is a set of instructions for a computer. They express different concepts and thus are not conceptually equivalent."
527,0,212,188,2,False,"An 'address' serves the function of localization, while 'computer code' performs computational tasks. They serve different functions and are not functionally equivalent."
528,0,212,188,3,False,The procedures for creating an 'address' (reference) differ significantly from those for writing 'computer code' (programming). They are not logically equivalent.
529,0,212,188,4,False,"Physically, an 'address' is a reference and 'computer code' is executable instructions. They are not interchangeable in a physical architecture."
530,1,212,51,1,False,"""An address is a reference for localizing an object, whereas a stakeholder is a person or group with an interest in a project. These express different concepts."""
531,1,212,51,2,False,"""An address performs the function of localizing an object, while a stakeholder plays a role in having an interest in a project. They serve different primary functions and are not functionally equivalent."""
532,1,212,51,3,False,"""The procedures for creating an address (providing localization) differ significantly from those for engaging a stakeholder (involving interest and participation in a project). Thus, they are not logically equivalent."""
533,1,212,51,4,False,"""An address is a reference for an object, whereas a stakeholder is a person or group. They are not physically interchangeable."""
534,0,160,113,1,False,"""Vornoi partitioning is a geometric method for dividing spaces, whereas a trade-off involves evaluating competing desirable outcomes. They express different concepts."""
535,0,160,113,2,False,"""While vornoi partitioning and trade-offs serve in decision-making contexts, they perform different functions: one is spatial partitioning, the other is balancing competing outcomes."""
536,0,160,113,3,False,"""The procedures involved in vornoi partitioning (geometric techniques) differ significantly from those in trade-offs (evaluating costs and benefits). They are not logically equivalent."""
537,0,160,113,4,False,"""Vornoi partitioning is a method for geometrically partitioning spaces, whereas a trade-off is an abstract decision-making scenario. They are not interchangeable in a physical sense."""
538,0,12,31,1,False,"Random forest utilizes a collection of trees for decision-making, whereas dictatorship emphasizes a single leader. They express different decision-making concepts."
539,0,12,31,2,False,"Random forest performs decision-making using an ensemble of trees, while dictatorship relies on a single leader's decisions. They function differently."
540,0,12,31,3,False,The logical procedures in random forests (aggregation of tree votes) differ from the absolute decision-making by a dictator. They are not logically equivalent.
541,0,12,31,4,False,"Random forest involves multiple decision trees, whereas dictatorship is characterized by the rule of one leader. They are not physically interchangeable."
542,1,256,139,1,False,"""An advisory board is a group of people who provide guidance, whereas information science is a field that studies information. These express different concepts."""
543,0,260,181,1,False,"Estimation theory is a field that studies estimating unknown parameters, whereas terms of service is a legal agreement for using a service. They express different concepts and cannot be substituted in a conceptual architecture."
544,0,260,181,2,False,"Estimation theory involves statistical methods for parameter estimation, while terms of service provides guidelines for using a service. They serve different functions."
545,0,260,181,3,False,The methods and procedures in estimation theory (statistical techniques) differ significantly from those in drafting terms of service (legal processes). Not logically equivalent.
546,0,260,181,4,False,"Estimation theory is a field of study involving theoretical and mathematical techniques, whereas terms of service is a legal document. They are not physically interchangeable."
547,1,19,87,1,False,"'Collaborative filtering' and 'decision-making process' express different concepts. One is a recommendation technique, the other is a series of steps to reach decisions."
548,1,19,87,2,False,"Collaborative filtering performs the function of recommending items, while a decision-making process performs the function of making decisions."
549,1,19,87,3,False,"The methods and procedures in collaborative filtering (similarity calculations, filtering) differ significantly from those in decision-making processes (steps to reach decisions). They are not logically equivalent."
550,1,19,87,4,False,"Collaborative filtering is implemented as an algorithmic technique in recommendation systems, whereas decision-making process refers broadly to any structured process for making decisions. They are not physically interchangeable."
551,0,268,173,1,False,"""Rawles Law"" is a decision-making principle emphasizing preparedness, whereas ""feedback"" provides information about a process input to itself. These concepts are different and cannot be substituted in a conceptual architecture without changing the architecture."
552,0,268,173,2,False,"""Rawles Law"" provides guidelines for being prepared, while ""feedback"" serves the function of regulating processes by providing internal information. They have different functions."
553,0,268,173,3,False,"The procedures and methods involved in applying ""Rawles Law"" (ensuring preparedness) differ significantly from those in creating feedback loops (process regulation). They are not logically equivalent."
554,0,268,173,4,False,"""Rawles Law"" is a principle or guideline, while ""feedback"" is an informational process within a system. They are not physically interchangeable."
555,1,267,28,1,False,"""Pareto frontier is a decision-making process that emphasizes finding the best trade-offs, while hard consensus is a decision-making process that emphasizes unanimity. They express different concepts in a conceptual architecture."""
556,1,267,28,2,False,"""Pareto frontier aims at finding optimal trade-offs among multiple criteria, whereas hard consensus strives for unanimity in decisions. They serve different primary functions."""
557,1,267,28,3,False,"""The methods and procedures in pareto frontier (optimization techniques) differ significantly from those in hard consensus (achieving unanimous agreement). They are not logically equivalent."""
558,1,267,28,4,False,"""Pareto frontier and hard consensus are different in a concrete sense: pareto frontier involves decision-making using trade-offs, while hard consensus requires unanimity. They are not physically interchangeable."""
559,0,244,236,1,False,"Bayesian inference updates beliefs based on evidence, while the DMAIC cycle defines, measures, analyzes, improves, and controls processes. These tasks express fundamentally different concepts and cannot be substituted in a conceptual architecture without changing the meaning."
560,0,244,236,2,False,"Bayesian inference serves to update beliefs based on new evidence, whereas the DMAIC cycle serves to systematically improve processes. They perform different primary functions and are not functionally equivalent."
561,0,244,236,3,False,"The methods and procedures involved in Bayesian inference (statistical updating) differ significantly from those in the DMAIC cycle (structured problem-solving steps). Thus, they are not logically equivalent."
562,0,244,236,4,False,"Bayesian inference involves statistical models and evidence updating, while the DMAIC cycle involves a systematic approach to process improvement. They are not physically interchangeable."
563,0,19,42,1,False,"A 'forum' is a place for discussion, while a 'node' is a device in a network. These concepts are fundamentally different."
564,0,19,42,2,False,"A 'forum' functions as a discussion platform, while a 'node' functions as a communication device in a network. They perform different functions."
565,0,19,42,3,False,The methods and procedures involved in managing a 'forum' (discussion facilitation) differ from those of managing a 'node' (network communication).
566,0,19,42,4,False,"A 'forum' is a virtual or physical place for discussion, whereas a 'node' is a physical network device. They are not physically interchangeable."
567,999,148,147,1,False,"""Direct democracy, where all participants vote on every decision, is conceptually different from representative governance which involves elected officials making decisions on behalf of the people."""
568,999,148,147,2,False,"""Direct democracy and representative governance perform different functions: one involves all participants voting on decisions, while the other involves elected officials making decisions on behalf of the people."""
569,999,148,147,3,False,"""The procedural methods for direct democracy (everyone voting) are different from those for representative governance (elected officials voting). They are not logically equivalent."""
570,999,148,147,4,False,"""Direct democracy involves all participants directly making decisions, whereas representative governance relies on elected officials. They are not physically interchangeable."""
571,0,247,224,1,False,"""Backcasting is a decision-making process that starts with a desired outcome and works backwards, whereas a hyperlink is a reference to another document. They express different concepts and cannot be substituted in a conceptual architecture without changing the architecture."""
572,0,247,224,2,False,"""Backcasting performs the function of guiding decisions toward a desired outcome, while a hyperlink performs the function of linking documents. They serve different primary functions and are not functionally equivalent."""
573,0,247,224,3,False,"""The methods and procedures involved in backcasting (working backwards from a desired outcome) differ significantly from the procedure of creating a hyperlink (linking documents). They are not logically equivalent."""
574,0,247,224,4,False,"""Backcasting is a methodological approach for decision-making, whereas a hyperlink is a digital or physical reference connecting documents. They are not physically interchangeable."""
575,0,218,189,1,False,"""Data is information in a form that can be processed, while source code is a set of instructions for a computer. They express different concepts in a conceptual architecture."""
576,0,218,189,2,False,"""Data serves the function of being information to be processed, while source code serves the function of instructing computational tasks. They perform different functions."""
577,0,218,189,3,False,"""The procedures for generating and processing data differ significantly from those for writing and executing source code. They are not logically equivalent."""
578,0,218,189,4,False,"""Data as processable information and source code as executable instructions are not physically interchangeable."""
579,0,52,45,1,False,"""A 'leader' is a person who guides a group, whereas a 'peer-to-peer protocol' is a set of rules for communication in a network. They express different concepts and cannot be substituted in a conceptual architecture without changing the meaning."""
580,0,52,45,2,False,"""The primary function of a 'leader' is to guide and direct a group, while a 'peer-to-peer protocol' functions to facilitate communication between nodes in a network. They serve different primary functions and are not functionally equivalent."""
581,0,52,45,3,False,"""The methods and procedures involved in leading a group (guidance and direction) differ significantly from those used in peer-to-peer protocols (rules for network communication). They are not logically equivalent."""
582,0,52,45,4,False,"""A 'leader' is an individual who interacts with people, while a 'peer-to-peer protocol' is a set of rules implemented in network software. They are not physically interchangeable."""
583,0,173,177,1,False,"""Feedback provides information about a process input to itself, while reflexivity reflects on oneself. Different concepts."""
584,0,173,177,2,False,"""Feedback serves to regulate a process, while reflexivity involves introspective analysis. They perform different functions."""
585,0,173,177,3,False,"""The methods of creating feedback loops (information flow) differ from those of reflexivity (self-reflection). They are not equivalent."""
586,0,173,177,4,False,"""Feedback as a process element and reflexivity as a cognitive process are not physically the same. Not interchangeable."""
587,0,11,38,1,False,"""A 'decision tree' is a method for making decisions based on a tree-like model, whereas 'consensus' is a general agreement among participants. They express different concepts and cannot be substituted in a conceptual architecture without changing the architecture."""
588,0,11,38,2,False,"""A 'decision tree' involves a structured process of branching decisions, while 'consensus' involves agreement among participants. They perform different functions."""
589,0,11,38,3,False,"""The procedures for constructing and using a decision tree (decision nodes, branches) differ significantly from those used to reach consensus (collaborative agreement). They are not logically equivalent."""
590,0,11,38,4,False,"""A 'decision tree' is often visually represented as a tree with branches, whereas 'consensus' is an abstract concept of general agreement. They are not physically interchangeable."""
591,0,3,25,1,False,"""Lasso regression pertains to statistical modeling by imposing shrinkage, whereas merge conflict is a problem that occurs when merging code changes. They express different concepts and cannot be substituted in a conceptual architecture without changing the architecture."""
592,0,3,25,2,False,"""Lasso regression serves the function of estimating relationships by reducing model complexity via shrinkage. Merge conflict, however, pertains to reconciling conflicting code changes during software integration. They perform different functions."""
593,0,3,25,3,False,"""The procedures and methods involved in lasso regression (statistical techniques for model selection) are distinct from those involved in resolving a merge conflict (source control operations). Thus, they are not logically equivalent."""
594,0,3,25,4,False,"""Lasso regression is a mathematical/statistical technique, whereas a merge conflict is an issue that arises in version control systems. They are not physically interchangeable."""
595,999,22,136,1,False,"Regression is a method for estimating relationships, whereas decision science is a field studying decision-making. They express different concepts."
596,999,22,136,2,False,"Regression functions to estimate relationships, while decision science provides frameworks and tools for decision-making. They perform different functions."
597,999,22,136,3,False,The methods and procedures for regression (statistical modeling) differ from those in decision science (decision frameworks). Not logically equivalent.
598,999,22,136,4,False,"Regression is a statistical technique, whereas decision science encompasses an academic field. They are not physically interchangeable."
599,0,98,229,1,False,"""Assumptions refer to beliefs taken for granted, while a call number is a reference code used to locate library items. These concepts express different ideas and cannot be substituted in a conceptual architecture without changing the meaning."""
600,0,98,229,2,False,"""Assumptions serve to provide foundational beliefs within decision-making processes, while a call number functions to categorize and locate library items. They perform different functions and are not functionally equivalent."""
601,0,98,229,3,False,"""The methods and procedures involved in forming assumptions (mental acceptance) differ significantly from those in assigning and utilizing call numbers (cataloging and classification). Therefore, they are not logically equivalent."""
602,0,98,229,4,False,"""Assumptions are intangible beliefs, whereas a call number is a tangible reference code. They are not physically interchangeable."""
603,0,198,245,1,False,"""Secondary rules pertain to meta-rules for creating other rules, whereas backcasting is a decision-making process focused on starting from a desired outcome and planning backward. These objects express different concepts."""
604,0,198,245,2,False,"""Secondary rules function to guide how other rules are created, while backcasting functions to prepare a plan starting from a future goal and working backward to the present. Different primary functions."""
605,0,198,245,3,False,"""The methods and procedures for establishing secondary rules (creating meta-rules) differ significantly from those in backcasting (reverse planning). Not logically equivalent."""
606,0,198,245,4,False,"""Secondary rules are abstract rules for rule-making, whereas backcasting is a methodological approach to planning. Not physically interchangeable."""
607,0,20,163,1,False,"""A forum is a group of stakeholders that engage in discussions, while an outlier is a data point significantly different from others. These objects express completely different concepts."""
608,0,37,82,1,False,"""A 'protocol' is a set of rules for communication, while a 'decision maker' is a person who makes a decision. These objects express different concepts and cannot be substituted in a conceptual architecture without changing the meaning."""
609,1,37,82,2,False,"""A 'protocol' performs the function of facilitating communication through a set of rules, while a 'decision maker' performs the function of making decisions. They serve different primary functions and are not functionally equivalent."""
610,2,37,82,3,False,"""The methods and procedures involved in establishing a 'protocol' (rule-making for communication) differ significantly from those in making decisions (exercising judgment). They are not logically equivalent."""
611,3,37,82,4,False,"""A 'protocol' is a set of written or codified rules for communication, while a 'decision maker' is an individual making decisions. They are not physically interchangeable."""
