relation_id,user_id,object1_id,object2_id,equivalence_id,value,explanation
854,0,128,111,1,False,"A feedback system provides information on a process, while activities refer to a set of tasks. These concepts express different ideas at a conceptual level."
855,0,128,111,2,False,"Functionally, a feedback system regulates processes by providing information, whereas activities involve executing tasks. They serve different functions."
856,0,128,111,3,False,"Logically, the procedures for implementing a feedback system (information feedback) are different from those for performing activities (task execution). They are not logically equivalent."
857,0,128,111,4,False,"Physically, a feedback system as an informational mechanism and activities as sets of tasks are not interchangeable."
858,999,194,216,1,False,"A 'moral code' consists of a set of ethical principles, while a 'content address' is a location for finding information derived from its content. These express different concepts and cannot be substituted in a conceptual architecture."
859,999,194,216,2,False,"A 'moral code' performs the function of providing ethical guidelines, while a 'content address' serves to locate information. They serve different functions."
860,999,194,216,3,False,The procedures for creating a 'moral code' (defining ethical principles) differ from those for determining a 'content address' (deriving location from content). They are not logically equivalent.
861,999,194,216,4,False,"Physically, a 'moral code' is a set of principles, whereas a 'content address' is a reference derived from content. They are not physically interchangeable."
862,0,127,239,1,False,"""An open-loop system operates without feedback, while PEST analysis is a decision-making process emphasizing political, economic, social, and technological factors. These concepts are fundamentally different and cannot be considered conceptually equivalent."""
863,0,127,239,2,False,"""An open-loop system performs the function of operating without feedback, while PEST analysis serves to analyze external environmental factors for decision-making. They perform different functions and are not functionally equivalent."""
864,0,127,239,3,False,"""The methods and procedures involved in managing an open-loop system (operating without feedback) are different from those in conducting PEST analysis (evaluating various factors). They are not logically equivalent."""
865,0,127,239,4,False,"""An open-loop system is a type of control system operating without feedback, whereas PEST analysis is an analytical decision-making process. They are not physically interchangeable."""
866,999,194,228,1,False,"A moral code consists of a set of ethical principles, whereas an ISBN is a reference to a book. These express different concepts and cannot be substituted in a conceptual architecture."
867,999,194,228,2,False,"A moral code performs the function of providing ethical guidelines, while an ISBN serves to identify books uniquely. They serve different functions and are not functionally equivalent."
868,999,194,228,3,False,The procedures for creating a moral code (defining ethical principles) differ significantly from those in assigning an ISBN (cataloging and referencing books). They are not logically equivalent.
869,999,194,228,4,False,"Physically, a moral code is a set of ethical principles, while an ISBN is a numeric reference assigned to a book. They are not physically interchangeable."
870,1,6,216,1,False,"Conceptually, 'anomaly detection' identifies rare items or events, whereas an 'identifier' provides a unique reference for an object. They express different concepts."
871,1,6,216,2,False,"Functionally, 'anomaly detection' performs the function of identifying anomalous data points, while an 'identifier' provides unique referencing. They perform different functions."
872,1,6,216,3,False,"Logically, the methods and procedures involved in 'anomaly detection' (statistical or machine learning methods) differ from those in generating 'identifiers' (creating unique references)."
873,1,6,216,4,False,"Physically, 'anomaly detection' as a process or algorithm and 'identifier' as a reference string or key are not physically interchangeable."
874,0,54,130,1,False,"Conceptually, a 'reviewer' is a person who evaluates code changes, while a 'system dynamics model' is a representation of a system using system dynamics. They express different concepts."
875,0,54,130,2,False,"Functionally, a 'reviewer' evaluates code changes, while a 'system dynamics model' serves to represent system behaviors through simulation. They serve different functions."
876,0,54,130,3,False,"Logically, the procedures of code review (evaluating and providing feedback on code) differ significantly from those involved in creating a system dynamics model (simulating and analyzing system behaviors)."
877,0,54,130,4,False,"Physically, a 'reviewer' is an individual performing reviews, while a 'system dynamics model' is typically represented as software or diagrams. They are not physically interchangeable."
878,1,244,25,1,False,"""Bayesian inference is a decision-making process using statistical updates, while a merge conflict is an issue in software merging. They express different concepts."""
879,999,173,161,1,False,"Feedback provides information about a process input to itself, whereas median is a mathematical operation to find the middle value. They express different concepts and cannot be substituted without changing the meaning."
880,999,173,161,2,False,"Feedback serves to regulate processes by providing internal information, while median calculates the middle value in a data set. They perform different functions."
881,999,173,161,3,False,The procedures for generating feedback (information loops) are distinct from those for calculating the median (statistical analysis). They are not logically equivalent.
882,999,173,161,4,False,Feedback as a process and median as a mathematical result are not physically the same and cannot be interchanged in a physical architecture.
883,9999,152,201,1,False,"""Delegation is the process where authority is transferred, whereas the Dewey Decimal System is a system for organizing library materials. They express different concepts and cannot be substituted in a conceptual architecture without changing the architecture."""
884,9999,152,201,2,False,"""Delegation performs the function of transferring authority, while the Dewey Decimal System functions to classify and organize library materials. They serve different primary functions and are not functionally equivalent."""
885,9999,152,201,3,False,"""The methods and procedures involved in delegation (assigning authority) differ significantly from those used in the Dewey Decimal System (classification and cataloging). They are not logically equivalent."""
886,9999,152,201,4,False,"""Delegation and the Dewey Decimal System are fundamentally different in a physical sense; one is a process of authority transfer, and the other is a classification system. They are not physically interchangeable."""
887,0,190,255,1,False,"""A 'legal code' is a set of laws, whereas a 'steering committee' is a group of people who guide a project. These express different concepts."""
888,0,190,255,2,False,"""A 'legal code' performs the function of providing structured laws, while a 'steering committee' performs the function of project guidance. Different functions."""
889,0,190,255,3,False,"""The procedures for drafting and implementing a 'legal code' differ significantly from those used by a 'steering committee' in guiding a project. They are not logically equivalent."""
890,0,190,255,4,False,"""A 'legal code' consists of documented laws, whereas a 'steering committee' is made up of individuals providing project guidance. They are not physically interchangeable."""
891,0,247,2,1,False,"""Scenario planning and least squares regression express different concepts: one is a decision-making process for creating scenarios, the other is a statistical method for estimating relationships."""
892,0,247,2,2,False,"""Scenario planning performs the function of creating multiple scenarios to aid in decision-making, while least squares regression aims to estimate relationships statistically. They serve different functions."""
893,0,247,2,3,False,"""The methods and procedures involved in scenario planning (drafting future scenarios) differ significantly from those used in least squares regression (statistical calculations). Not logically equivalent."""
894,0,247,2,4,False,"""Scenario planning is an abstract process involving decision-making techniques, while least squares regression is a concrete statistical method. They are not physically interchangeable."""
895,0,244,141,1,False,"Bayesian inference is a decision-making process focused on updating beliefs based on evidence, while cognitive science is a field of study that investigates the representation and manipulation of knowledge. These are conceptually different objects and cannot be substituted without altering their conceptual framework."
896,0,244,141,2,False,"Bayesian inference performs the function of making decisions through belief updates based on evidence, whereas cognitive science performs the function of understanding cognitive processes and knowledge manipulation. They serve different functions."
897,0,244,141,3,False,The methods and procedures in Bayesian inference (statistical updates) differ significantly from those in cognitive science (research into cognitive processes and knowledge representation). They do not follow the same logical rules.
898,0,244,141,4,False,"Physically, Bayesian inference involves statistical models and belief updating methodologies, while cognitive science consists of theoretical and experimental studies of cognitive processes. They are not physically interchangeable."
899,0,207,220,1,False,"""Knowledge organization is the process of structuring and categorizing knowledge, whereas knowledge is information that has been interpreted. While they are closely related, they express different concepts and serve distinct functions. Knowledge organization focuses on organizing and managing knowledge, whereas knowledge itself is the interpreted information obtained from data. Therefore, they are not interchangeable conceptually."""
900,2,68,174,2,False,"Techniques and feedforward serve fundamentally different roles. Techniques achieve goals, while feedforward involves process inputs."
901,0,257,260,1,False,"""An executive committee is a group that makes high-level decisions, whereas estimation theory is a field that studies estimating unknown parameters. They express different concepts and cannot be considered equivalent in a conceptual architecture."""
902,0,46,101,1,False,"""A contributor is a person who contributes to a project, whereas incentives are a set of motivations. They express different concepts."""
903,0,46,101,2,False,"""A contributor performs the function of contributing to a project, while incentives aim to motivate behavior. Different functions."""
904,0,46,101,3,False,"""The methods and procedures for contributing to a project differ from those for setting up incentives. They are not logically equivalent."""
905,0,46,101,4,False,"""A contributor is a person, while incentives are abstract motivations. They are not physically interchangeable."""
906,2023,58,37,1,False,"A 'secretary' is a person who records information, whereas a 'protocol' is a set of rules for communication. They express different concepts."
907,2023,58,37,2,False,"A 'secretary' performs the function of recording information, while a 'protocol' facilitates communication. They serve different functions."
908,2023,58,37,3,False,The methods and procedures involved in recording information (secretary) differ significantly from those used to establish a protocol (communication rules).
909,2023,58,37,4,False,"A 'secretary' is a person performing a role, whereas a 'protocol' is an abstract set of rules. They are not physically interchangeable."
910,200,91,20,2,False,"""A theoretical model represents systems using equations or rules, while clustering groups similar items. They serve different functions."""
911,2023,16,138,1,False,"""Clustering is a method for grouping similar items, whereas computer science is a field that studies computation. They express different concepts and cannot be considered conceptually equivalent."""
912,2023,16,138,2,False,"""Clustering performs the function of grouping similar items, while computer science functions broadly to study computation. They serve different primary functions."""
913,2023,16,138,3,False,"""The methods and procedures involved in executing clustering (algorithmic grouping) differ from those used in computer science (theoretical and practical computation). They are not logically equivalent."""
914,2023,16,138,4,False,"""Clustering, often algorithmic and specific, and computer science, encompassing a broad field of study, cannot be interchanged physically."""
915,0,248,70,1,False,"""Dynamic programming is a decision-making process that focuses on breaking a problem into subproblems, whereas a model is a representation of a system. They express different concepts and cannot be substituted in a conceptual architecture without changing the architecture."""
916,0,248,70,2,False,"""Dynamic programming performs the function of optimizing decision-making by breaking down problems, while a model functions to represent a system. They perform different primary functions and are not functionally equivalent."""
917,0,248,70,3,False,"""The methods and procedures in dynamic programming (decomposing problems into subproblems) differ significantly from those in creating a model (representing system components). They are not logically equivalent."""
918,0,248,70,4,False,"""Dynamic programming is a specific decision-making methodology often involving algorithms, while a model is a conceptual or computational representation of a system. They are not physically interchangeable."""
919,1,79,167,1,False,"""Relationship"" is a connection between objects, while ""supervision"" is the process of overseeing others. These concepts express different ideas."""
920,1,79,167,2,False,"""Relationship"" serves to connect objects, whereas ""supervision"" performs the function of overseeing individuals. They serve different functions."""
921,1,79,167,3,False,"""The methods and procedures for establishing relationships differ significantly from those for supervising others (overseeing activities). Not logically equivalent."""
922,1,79,167,4,False,"""Relationship and supervision are not physically the same: one is an abstract connection, while the other is an activity performed by individuals. They are not physically interchangeable."""
923,0,127,265,1,False,"An 'open-loop system' operates without feedback, whereas 'pareto optimization' is a decision-making process that emphasizes maximizing the most important factors. They express different concepts and cannot be considered conceptually equivalent."
924,0,127,265,2,False,"An 'open-loop system' serves the function of operating without feedback, while 'pareto optimization' serves to optimize decision outcomes by prioritizing factors. They perform different functions and are not functionally equivalent."
925,0,127,265,3,False,The procedures involved in managing an open-loop system (operating without feedback) differ significantly from those in performing pareto optimization (analyzing and prioritizing factors). They are not logically equivalent.
926,0,127,265,4,False,"An 'open-loop system' is a control system operating without feedback, whereas 'pareto optimization' is a conceptual decision-making process. They are not physically interchangeable."
927,200,59,233,1,False,"A 'chair' is a person who leads a meeting, whereas a PID controller is a control system that regulates a process using proportional, integral, and derivative terms. They express different concepts."
928,200,59,233,2,False,"A 'chair' performs the function of leading a meeting, while a PID controller regulates a process. They serve different functions."
929,200,59,233,3,False,The methods and procedures involved in chairing a meeting differ significantly from those in regulating a process using a PID controller. Not logically equivalent.
930,200,59,233,4,False,"A 'chair' is a person, whereas a PID controller is a physical control system. They are not physically interchangeable."
931,1,132,108,1,False,"Operations research is a field that applies analytical methods to decision-making, whereas expectation management is a process for aligning anticipated outcomes with actual outcomes. Although they can both be related to the broader context of improving decision-making, they serve different primary functions and are not conceptually equivalent."
932,1,132,108,2,False,"Functionally, operations research and expectation management perform different roles. Operations research applies analytical methods to enhance decision-making processes, while expectation management focuses on aligning anticipated and actual outcomes. Their primary functions differ, making them not functionally equivalent."
933,1,132,108,3,False,"Logically, the procedures and methods involved in operations research (analytical and computational techniques) are distinct from those used in expectation management (aligning expectations with outcomes). Therefore, they are not logically equivalent."
934,1,132,108,4,False,"Physically, operations research typically involves specific analytical models and tools, while expectation management involves processes and strategies. They are not physically interchangeable."
935,1,6,58,1,False,"'Anomaly detection' identifies rare items or events, whereas a 'secretary' records information. Different concepts."
936,1,6,58,2,False,"'Anomaly detection' serves to detect anomalies, while a 'secretary' records information. Different functions."
937,1,6,58,3,False,Methods for anomaly detection (statistical/machine learning) differ from those for recording information.
938,1,6,58,4,False,"'Anomaly detection' and a 'secretary' are not physically interchangeable; one is a method, the other a person."
939,1,252,125,1,False,"Conceptually, a 'team' is a group of people who work together, whereas a 'feedback system' is a system that provides information on a process. They express different concepts."
940,1,252,125,2,False,"Functionally, a 'team' performs the function of collaboration and completing tasks, while a 'feedback system' performs the function of providing information to regulate a process. Different functions."
941,1,252,125,3,False,"Logically, the procedures and methods involved in team collaboration (communication, coordination) differ significantly from those in a feedback system (collecting and providing feedback information). Not logically equivalent."
942,1,252,125,4,False,"Physically, a 'team' consists of individuals working collaboratively, while a 'feedback system' is an automated or mechanized system providing information. They are not physically interchangeable."
943,0,19,236,1,False,"A forum is a place for discussion, whereas the DMAIC cycle is a decision-making process. They express different concepts."
944,0,19,236,2,False,"A forum serves to facilitate discussions, while the DMAIC cycle serves to guide systematic process improvements. Different functions."
945,0,19,236,3,False,"The methods and procedures for managing a forum (moderation, discussion facilitation) differ significantly from those in the DMAIC cycle (defined steps)."
946,0,19,236,4,False,"A forum is a virtual or physical place for discussion, whereas the DMAIC cycle is a conceptual process for decision-making. Not physically interchangeable."
947,999,81,142,1,False,Affected stakeholder and artificial intelligence express fundamentally different concepts. The former pertains to those impacted by decisions; the latter studies computational sense-making and decision-making.
948,999,81,142,2,False,"While an affected stakeholder participates in decision impacts, artificial intelligence serves to create decision-making systems, performing different functions."
949,999,81,142,3,False,"The methods of engaging affected stakeholders (impact assessment) differ from those in artificial intelligence (algorithm creation), making them logically distinct."
950,999,81,142,4,False,"Affected stakeholder is a person or group, whereas artificial intelligence involves software and algorithms. They are not physically interchangeable."
951,0,129,12,2,False,"""System dynamics models the behavior of systems over time through simulation, while random forest is a machine learning method for making decisions through an ensemble of decision trees. They perform different functions in their respective domains."""
952,0,253,249,1,True,Both 'working group' and 'committee' are conceptually related as groups of people working on tasks or making decisions.
953,0,253,249,2,False,"While a 'working group' performs collaborative tasks, a 'committee' makes formal decisions. They serve different functions."
954,0,253,249,3,False,The methods and procedures for a 'working group' (collaborative task management) differ from those of a 'committee' (formal decision-making). They are not logically equivalent.
955,0,253,249,4,False,"A 'working group' consists of individuals collaborating on tasks, while a 'committee' typically consists of individuals making formal decisions. They are not physically interchangeable."
956,0,101,88,1,False,"Incentives are a set of motivations aimed at influencing behavior, whereas an empirical model is a representation of a system based on data. They express different concepts and cannot be considered conceptually equivalent."
957,0,272,182,1,False,"""Trade-off analysis is a decision-making process emphasizing analyzing costs and benefits of decisions, while terms of use is a legal agreement for using a product. They express different concepts."""
958,0,272,182,2,False,"""Trade-off analysis serves to evaluate the costs and benefits of decisions, whereas terms of use serves to provide guidelines for product usage. They perform different functions."""
959,0,272,182,3,False,"""The methodologies and procedures involved in trade-off analysis (analyzing costs and benefits) differ significantly from those in drafting terms of use (legal processes for product usage). They are not logically equivalent."""
960,0,272,182,4,False,"""Trade-off analysis is a conceptual decision-making process, while terms of use represents a legal document. They are not physically interchangeable."""
961,0,155,71,1,False,"The concept of delegation, which is concerned with transferring authority, is fundamentally different from a method, which describes a way of doing something. They express different concepts."
962,0,155,71,2,False,"Delegation performs the function of transferring authority, while a method serves to describe a way of doing something. They perform different primary functions."
963,0,155,71,3,False,The procedures involved in delegation (transferring authority) differ significantly from those involved in employing a method (implementing a way of doing something). They are not logically equivalent.
964,0,155,71,4,False,"Delegation is a process of transferring authority, whereas a method is an abstract way of performing tasks. They are not physically interchangeable."
965,2023,199,189,1,False,"""Primary rules express a set of rules for conduct, while source code is a set of instructions in a programming language. They express different concepts."""
966,2023,199,189,2,False,"""Primary rules guide behavior, while source code performs computational tasks. They serve different functions."""
967,2023,199,189,3,False,"""The methods and procedures for defining primary rules (behavior guidelines) differ significantly from those for writing and executing source code (programming). They are not logically equivalent."""
968,2023,199,189,4,False,"""Primary rules are conceptual guidelines for conduct, whereas source code is a concrete set of programming instructions. They are not physically interchangeable."""
969,0,263,202,0,False,"The Cynefin framework is a decision-making framework emphasizing complexity management, whereas primary rules are a set of rules for conduct. They express different concepts and cannot be considered conceptually equivalent in a conceptual architecture."
970,0,263,202,1,False,"The Cynefin framework performs the function of guiding decision-making in complex contexts, while primary rules guide behaviour. They serve different primary functions and are not functionally equivalent."
971,0,263,202,2,False,The methods and procedures of using the Cynefin framework (contextual decision-making) differ from those in primary rules (setting behaviour guidelines). They are not logically equivalent.
972,0,263,202,3,False,"The Cynefin framework is a structured decision-making framework, whereas primary rules are a set of conduct rules. They are not physically interchangeable."
973,1,60,267,1,False,"A 'voter' is a person who participates in a voting-based decision, while 'pareto frontier' is a decision-making process that emphasizes finding the best trade-offs. They express different concepts."
974,1,60,267,2,False,"A 'voter' performs the function of casting votes, while 'pareto frontier' aims to identify the best trade-offs among multiple criteria. They perform different functions."
975,1,60,267,3,False,The logical steps of a voter casting a vote differ significantly from those involved in determining the Pareto frontier. They are not logically equivalent.
976,1,60,267,4,False,"A 'voter' is a person, whereas 'pareto frontier' is a decision-making methodology. They are not physically interchangeable."
