relation_id,user_id,object1_id,object2_id,equivalence_id,value,explanation
0,1,2,3,2, True,"""Both objects perform the function statistical regression by they do so according to different algorithms."""
1,1,2,3,3, False,"""These two regressions use different algorithms so they are not logically equivalent."""
2,1,12,13,2,True,"""Both objects perform the function of decision-making through different forms of aggregation."""
3,1,12,13,3,False,"""The objects use distinct algorithms and methods (trees vs. nodes) and are not logically equivalent."""
4,1,47,7,1,True,"""Both objects are conceptually related in the context of project management where the maintainer ensures smooth operation by making sense of experiences and data."""
5,1,47,7,2,False,"""The maintainer manages a project, which is functionally different from the process of giving meaning to experiences."""
6,1,47,7,3,False,"""The procedures carried out by a maintainer and those involved in sense-making are not logically equivalent."""
7,1,47,7,4,False,"""A maintainer and the process of sense-making are not physically the same and are not interchangeable."""
8,4,174,205,7,True,"""Both objects involve the movement of information within systems to support a process. Although 'feedforward' relates to forwarding information for process input, 'information retrieval' involves finding information to serve a purpose. They conceptually relate as both deal with the use of information."""
9,3,12,13,2,True,Both objects perform the function of decision-making through different forms of aggregation.
10,3,12,13,3,False,The objects use distinct algorithms and methods (trees vs. nodes) and are not logically equivalent.
11,0,3,126,1,True,"""Both objects involve optimizing processes: lasso regression optimizes model parameters with regularization, while feedback control systems optimize process performance through feedback mechanisms. They conceptually relate as both are methods aimed at improving system performance."""
12,0,3,126,2,False,"""A lasso regression is a specific algorithm in statistical modeling, while a feedback control system is a broader system concept. They perform different specific functions."""
13,0,3,126,3,False,"""The procedures and methods used in lasso regression and feedback control systems are distinct - one employs statistical regularization and the other involves control theory."""
14,0,3,126,4,False,"""A lasso regression is a mathematical technique, while a feedback control system is a physical implementation in control engineering. They are not physically interchangeable."""
15,0,155,168,1,True,"""Both 'authority' and 'management' are conceptually related, as both involve making decisions and coordinating resources."""
16,0,155,168,2,False,"""Authority involves the right to make decisions, whereas management involves the process of coordinating resources â€“ they serve different functions."""
17,0,155,168,3,False,"""The methods and procedures for exercising authority and management differ, indicating they are not logically equivalent."""
18,0,155,168,4,False,"""Authority and management are not physically the same and cannot be interchanged in a physical architecture."""
19,0,146,181,1,True,"""Participatory governance involves stakeholders in making decisions, which often necessitates terms or agreements akin to 'terms of service' that outline usage, creating a conceptual relation."""
20,1,146,181,2,False,"""Participatory governance and terms of service serve different functions: the former is a governance system including stakeholders, the latter is a legal agreement guiding usage."""
21,2,146,181,3,False,"""The methods and procedures in participatory governance versus terms of service are quite distinct, thus not logically equivalent."""
22,3,146,181,4,False,"""Physically, participatory governance is a governance system, while terms of service is a legal document, making them non-interchangeable in a physical architecture."""
23,1,12,13,2,True,"Both objects perform the function of decision-making through different forms of aggregation. A random forest uses a collection of decision trees, while a neural network utilizes a network of nodes. They are functionally equivalent as both aim to improve decision-making accuracy."
24,1,12,13,3,False,"The objects use distinct algorithms and methods: random forest relies on an ensemble of decision trees and voting mechanisms, whereas a neural network depends on layers of interconnected nodes and weight adjustment through training. Hence, they are not logically equivalent."
25,1,12,13,1,True,"Both objects are related conceptually in the context of machine learning techniques designed for making predictive decisions, often employed in similar scenarios but with differing internal mechanics."
26,1,12,13,4,False,Random forest and neural network implementations are different in physical architecture; they are not interchangeable at a physical level as one employs tree structures and the other utilizes a network of nodes.
27,0,187,70,1,True,"Both 'code' and 'model' are conceptually related as they represent structured forms of information and guidelines to achieve a certain purpose, thus expressing the same concept in a conceptual architecture."
28,0,187,70,2,False,"Although 'code' and 'model' aim to provide structure, they perform different functions: code is executed to perform tasks, whereas a model represents a system for understanding and analysis."
29,0,187,70,3,False,"The procedures for creating 'code' (writing instructions for computers) and creating a 'model' (representing system components) differ, indicating they are not logically equivalent."
30,0,187,70,4,False,"Physically, 'code' consists of executable instructions, whereas a 'model' is often a visual or abstract representation, making them non-interchangeable in a physical architecture."
31,0,3,154,1,False,"""Lasso regression is a statistical method focused on model optimization by imposing shrinkage, whereas responsibility is a process related to carrying out authority. They express different concepts in a conceptual architecture."""
32,0,3,154,2,False,"""Lasso regression performs the function of estimating relationships by reducing model complexity via shrinkage. Responsibility, on the other hand, involves the execution of duties related to authority. Thus, they perform different functions."""
33,0,3,154,3,False,"""The methods and procedures of lasso regression, which involve statistical techniques for model selection, differ from the procedures involved in exercising responsibility. They are not logically equivalent."""
34,0,3,154,4,False,"""Lasso regression is a mathematical/statistical method, whereas responsibility is a process related to the exercise of authority. They are not physically interchangeable."""
35,0,198,224,1,False,"""Secondary rules refer to meta-rules governing how other rules are created, which is conceptually different from a URI, which is a specific reference to a resource on the internet."""
36,0,146,231,1,False,"""Machine learning studies inference and data interpretation by computers, while call number is a reference for a library item. They express different concepts in a conceptual architecture."""
37,0,146,231,2,False,"""Machine learning is a method for data analysis, while call number is a method for locating library items. They perform different functions."""
38,0,146,231,3,False,"""Machine learning involves algorithms and training data, while a call number involves cataloging and classification in libraries. Different procedures are involved."""
39,0,146,231,4,False,"""Machine learning is implemented with computer software and hardware, while a call number is a manually assigned library reference. They are not physically interchangeable."""
40,0,155,219,1,False,"""Authority and information are conceptually distinct. Authority pertains to the right to make decisions, whereas information refers to data that has been processed. These concepts serve different purposes in a conceptual architecture."""
41,0,155,219,2,False,"""Authority involves the function of decision-making, while information is the outcome of data processing. They perform different functions."""
42,0,155,219,3,False,"""The procedures and methods for exercising authority differ from those involving the processing of information. Thus, they are not logically equivalent."""
43,0,155,219,4,False,"""Authority is a role or position where decisions are made, while information is data that has been processed and interpreted. They are not interchangeable in a physical architecture."""
44,0,229,209,1,False,"""A call number is a reference for a library item, while knowledge management is a process for managing knowledge. They express different concepts in a conceptual architecture."""
45,0,229,209,2,False,"""A call number helps in locating literature, whereas knowledge management involves organizing, storing, and retrieving knowledge. They perform different functions."""
46,0,229,209,3,False,"""The procedures for assigning a call number (cataloging) are different from those for knowledge management (organizing and processing information). They are not logically equivalent."""
47,0,229,209,4,False,"""Physically, a call number is a code assigned to library items, while knowledge management involves a set of actions and tools for handling knowledge. They are not physically interchangeable."""
48,0,236,153,1,True,"""Both the DMAIC cycle and accountability aim at ensuring processes are carried out effectively  and correctly, thus expressing a similar concept."""
49,0,236,153,2,False,"""DMAIC focuses on process improvement through structured steps, while accountability ensures authority is properly enforced. They serve different primary functions."""
50,0,236,153,3,False,"""The methods and procedures in DMAIC (Define, Measure, Analyze, Improve, Control) are distinct from those involved in enforcing accountability."""
51,0,236,153,4,False,"""DMAIC is a structured methodology used in Six Sigma, while accountability is a broader concept. They are not interchangeable in a physical architecture."""
52,0,250,71,1,True,Both 'board' and 'system' are conceptually related as they are collections of parts working together.
53,0,250,71,2,False,"A 'board' specifically oversees an organization, while a 'system' is a broader concept not limited to oversight. They perform different functions."
54,0,250,71,3,False,"The procedures for a 'board' overseeing an organization differ greatly from the interconnectivity of parts in a 'system.' Therefore, they are not logically equivalent."
55,0,250,71,4,False,"A 'board' consists of people, whereas a 'system' can consist of various parts (mechanical, digital, etc.). They are not physically interchangeable."
56,0,178,68,1,False,"""Self-reference is about referring to oneself, while a technique is a method for achieving a goal. They express different concepts."""
57,0,178,68,2,False,"""Self-reference refers to a process intrinsic to the subject itself, while a technique is an external method for accomplishing tasks. They perform different functions."""
58,0,178,68,3,False,"""The procedures and steps involved in self-reference are quite different from techniques used to achieve goals. They are not logically equivalent."""
59,0,178,68,4,False,"""Self-reference and a technique are not physically interchangeable, as one is a process of referring to oneself and the other is a method for accomplishing a goal."""
60,0,138,168,1,False,"""Computer science studies computation, while management focuses on coordinating resources. These concepts are distinct."""
61,0,138,168,2,False,"""Computer science performs the function of analyzing computation; management performs the function of resource coordination. Different functions."""
62,0,138,168,3,False,"""The methods and procedures in computer science (algorithm development, computational theories) differ from those in management (resource coordination). Not logically equivalent."""
63,0,138,168,4,False,"""Computer science is often implemented with hardware and software systems, while management organizes human and material resources. Not physically interchangeable."""
64,0,255,193,1,False,"""A steering committee guides a project, while a professional code dictates professional behavior. They express different concepts."""
65,0,255,193,2,False,"""A steering committee performs the function of project guidance, while a professional code regulates behavior. They serve different functions."""
66,0,255,193,3,False,"""The procedures and methods of guiding a project by a steering committee are distinct from the rules set by a professional code. They are not logically equivalent."""
67,0,255,193,4,False,"""A steering committee is a group of people, whereas a professional code is a set of written rules. They are not physically interchangeable."""
68,0,71,29,1,False,"""A 'system' is a set of connected parts, while 'majority rule' is a decision-making process. They express different concepts."""
69,0,71,29,2,False,"""A 'system' performs the function of interconnected components working together, while 'majority rule' is for decision-making."""
70,0,71,29,3,False,"""The methods and rules that constitute a 'system' differ significantly from the procedures of 'majority rule' decision-making."""
71,0,71,29,4,False,"""Physically, a 'system' might consist of various parts like hardware or software, while 'majority rule' pertains to decision processes and is not physically interchangeable."""
72,0,240,251,1,False,"""STEEP analysis is a decision-making process analyzing social, technological, economic, environmental, and political factors. A council is a group of people who advise or make decisions. They express different concepts in a conceptual architecture."""
73,0,240,251,2,False,"""STEEP analysis functions to provide a structured analysis for decision-making, whereas a council performs the function of advising or making decisions. They serve different primary functions."""
74,0,240,251,3,False,"""The procedures and methods in STEEP analysis (analysis of various factors) differ from the procedures within a council (deliberation and decision-making). Thus, they are not logically equivalent."""
75,0,240,251,4,False,"""STEEP analysis is a process involving analytical techniques, whereas a council consists of individuals. They are not physically interchangeable in a physical architecture."""
76,0,255,123,1,True,Both 'steering committee' and 'decision-making system' are conceptually related as they are both involved in guiding or aiding decision-making processes within a project or organization.
77,0,255,123,2,False,"While a steering committee provides guidance and oversight, a decision-making system is a technological tool for decision support. They perform different functions."
78,0,255,123,3,False,The procedures and methods in a steering committee (deliberation and guidance) differ from those in a decision-making system (algorithmic or software-based decision support). They are not logically equivalent.
79,0,255,123,4,False,"A steering committee consists of people, whereas a decision-making system is typically software. They are not physically interchangeable."
80,0,164,180,1,False,"""Anomalies and self-organization express different concepts. An anomaly is a rare or unexpected data point, while self-organization is the process of organizing oneself."""
81,0,164,180,2,False,"""Anomalies and self-organization perform different functions. An anomaly is related to unexpected data, while self-organization involves the autonomous arrangement of systems."""
82,0,164,180,3,False,"""Methods and procedures for detecting anomalies differ significantly from those used in self-organization processes."""
83,0,164,180,4,False,"""Anomalies and self-organization are not physically the same and cannot be used interchangeably in a physical architecture."""
84,0,38,205,1,False,"""Consensus, as a general agreement, and information retrieval, as a process for finding information, express different concepts in a conceptual architecture."""
85,0,192,71,1,True,Both 'source code' and 'method' are conceptually related as source code is a specific type of method implemented as instructions in a programming language.
86,0,192,71,2,False,"While both aim to perform certain tasks, 'source code' is specific to programming, whereas 'method' is broader in application."
87,0,192,71,3,False,"The procedures for writing 'source code' differ from generalized 'methods', which encompass a wide range of activities."
88,0,192,71,4,False,"'Source code' is physically written instructions, whereas 'method' is an abstract concept, making them not physically interchangeable."
89,0,239,174,1,False,"'PEST analysis' is a decision-making process emphasizing political, economic, social, and technological factors, whereas 'feedforward' is information about a process input to another process. They express different concepts in a conceptual architecture."
90,0,239,174,2,False,"'PEST analysis' functions to analyze multiple environmental factors for decision-making, while 'feedforward' relays information for process inputs. Different functions."
91,0,239,174,3,False,"The procedures and methods in 'PEST analysis' involve structured analysis of factors, while 'feedforward' pertains to information flow in processes. Not logically equivalent."
92,0,239,174,4,False,"'PEST analysis' is an analytical process, whereas 'feedforward' involves information flow mechanisms. They are not physically interchangeable."
93,0,175,252,1,False,"""The concept of 'control' pertains to the process of regulating a system, whereas a 'team' is a group of people who work together. These ideas express different concepts in a conceptual architecture."""
94,0,175,252,2,False,"""Control performs the function of regulating a system, while a team functions together to accomplish tasks. They perform different functions."""
95,0,175,252,3,False,"""The methods and procedures of regulating a system (control) differ significantly from the collaborative efforts of a team. They are not logically equivalent."""
96,0,175,252,4,False,"""Control as a process and a team as a group of people are not physically interchangeable."""
97,0,249,154,1,False,"""A committee is a group of people who make decisions, while responsibility is the process where authority is carried out. They express different concepts in a conceptual architecture."""
98,0,249,154,2,False,"""A committee performs the function of making decisions, whereas responsibility is the execution of duties related to authority. They serve different primary functions."""
99,0,249,154,3,False,"""The procedures and methods involved in the activities of a committee (collective deliberation and decision-making) are distinct from those involved in carrying out responsibility (exercising duties and authority). They are not logically equivalent."""
100,0,249,154,4,False,"""A committee is a group of people, whereas responsibility is a process related to carrying out an authority. They are not physically interchangeable."""
101,0,63,177,1,False,"""A decision is a course of action determined after consideration, while reflexivity is the process of reflecting on oneself. They express different concepts."""
102,0,63,177,2,False,"""A decision performs the function of concluding an action, whereas reflexivity involves introspection. Different functions."""
103,0,63,177,3,False,"""The procedures for making a decision differ significantly from those involved in reflexivity (self-reflection)."""
104,0,63,177,4,False,"""A decision is an action taken, while reflexivity is a cognitive process. They are not physically interchangeable."""
105,0,19,52,1,False,"""A 'forum' is a place for discussion, whereas a 'user' is a person who uses a system. They express different concepts."""
106,1,19,52,2,False,"""A 'forum' serves the function of facilitating discussions, while a 'user' interacts with the system. Different functions."""
107,2,19,52,3,False,"""The procedures for managing a 'forum' (moderation, discussion facilitation) differ from the behaviors of a 'user'. Not logically equivalent."""
108,3,19,52,4,False,"""A 'forum' is a virtual or physical place, whereas a 'user' is an individual person. They are not physically interchangeable."""
109,0,81,233,1,False,"""An affected stakeholder is a person or group impacted by a decision or system, whereas a PID controller is a control system that regulates a process using proportional, integral, and derivative terms. These express different concepts and cannot be substituted in a conceptual architecture without changing their meaning."""
110,1,81,233,2,False,"""An affected stakeholder performs the function of being impacted by decisions or systems, while a PID controller performs the function of regulating a process. They serve different functions and are not functionally equivalent."""
111,2,81,233,3,False,"""The procedures and methods involved in the activities of an affected stakeholder (experiencing the impacts of decisions) are distinct from those involved in the regulation by a PID controller (control algorithms). They are not logically equivalent."""
112,3,81,233,4,False,"""An affected stakeholder is a person or group, whereas a PID controller is a physical control system. They are not physically interchangeable."""
113,0,180,226,1,False,"'Self-organization' is the process of organizing oneself, while an 'ISBN' is a reference to a book. They express different concepts."
114,0,180,226,2,False,"'Self-organization' performs the function of organizing a system autonomously, while an 'ISBN' serves to uniquely identify and reference a book. Different functions."
115,0,180,226,3,False,The procedures involved in 'self-organization' differ greatly from the assignment and use of an 'ISBN'. Not logically equivalent.
116,0,180,226,4,False,'Self-organization' and an 'ISBN' are not physically interchangeable; one is a process and the other is a reference code.
117,0,91,95,1,False,"""A 'contract' is a legal agreement, whereas 'expectations' are a set of anticipated outcomes. They express different concepts in a conceptual architecture."""
118,0,91,95,2,False,"""A contract performs the function of legally binding agreements, while expectations involve anticipated outcomes. They perform different functions."""
119,0,91,95,3,False,"""The procedures for creating a contract (legal drafting) are different from managing expectations. They are not logically equivalent."""
120,0,91,95,4,False,"""Physically, a contract is a legal document, while expectations are intangible thoughts or anticipations. They are not physically interchangeable."""
121,0,209,11,1,False,"""Knowledge management is the process of managing knowledge, whereas a decision tree is a method for making decisions. They express different concepts."""
122,0,209,11,2,False,"""Knowledge management involves the organization, storage, and retrieval of knowledge, while a decision tree visualizes decision-making pathways. They perform different functions."""
123,0,209,11,3,False,"""The procedures for managing knowledge are distinct from those involved in creating and using decision trees. They are not logically equivalent."""
124,0,209,11,4,False,"""Physically, knowledge management tools and systems differ from decision trees, which are chart-based representations. They are not interchangeable at a physical level."""
125,0,268,269,1,False,"""Rawles Law emphasizes the importance of preparedness, while Murphy's Law emphasizes planning for the worst. They express different concepts."""
126,0,268,269,2,False,"""Rawles Law's function is to ensure readiness, while Murphy's Law's function is to prepare for potential failures. They perform different functions."""
127,0,268,269,3,False,"""The methodologies for preparing (Rawles Law) and planning for worst-case scenarios (Murphy's Law) are distinct and not logically equivalent."""
128,0,268,269,4,False,"""Rawles Law and Murphy's Law are principles and cannot be physically interchangeable."""
129,0,12,244,1,False,"""Random forest is a method for making decisions based on a collection of trees, while Bayesian inference is a decision-making process that emphasizes updating beliefs based on evidence. They express different concepts in a conceptual architecture."""
130,0,12,244,2,False,"""Random forest performs decision-making using an ensemble of decision trees, whereas Bayesian inference updates beliefs based on evidence. They perform different functions in decision-making."""
131,0,12,244,3,False,"""The methodologies and procedures for decision-making in random forest (bagging and bootstrapping) differ from those in Bayesian inference (Bayes' theorem and evidence updating). Thus, they are not logically equivalent."""
132,0,12,244,4,False,"""Random forest is implemented using multiple decision trees in a computational process, whereas Bayesian inference is a probabilistic model for updating beliefs. They are not physically interchangeable."""
133,0,162,242,3,False,"""Thresholds and decision-making frameworks are fundamentally different in their scope and methods. A threshold involves a specific value to separate categories, while a decision-making framework encompasses a set of rules and procedures for making decisions. Due to their different purposes and methods, they are not logically equivalent."""
134,0,210,149,1,False,"""Infrastructure refers to a set of resources that support a system, whereas deliberative democracy is a system of decision-making where participants discuss and debate decisions. These express different concepts."""
135,0,210,149,2,False,"""Infrastructure performs the function of supporting systems through resources, while deliberative democracy functions by facilitating discussion and decision-making. They perform different functions."""
