relation_id,user_id,object1_id,object2_id,equivalence_id,value,explanation
258,0,1,153,3,False,The methods and rules within 'Roberts rules of order' (parliamentary procedures) differ from those in enforcing accountability. Not logically equivalent.
259,0,1,153,4,False,"'Roberts rules of order' is a document/manual, while 'accountability' is abstract and procedural. Not physically interchangeable."
260,0,247,25,1,False,"`""Scenario planning involves creating multiple future scenarios to explore possible outcomes, whereas a merge conflict is a specific problem that occurs when merging code changes. They express different concepts and cannot be substituted in a conceptual architecture without changing the meaning.""`"
261,0,192,82,1,False,"""An 'ethical code' is a set of rules for ethical behavior, whereas a 'decision maker' is a person who makes a decision. They express different concepts."""
262,0,192,82,2,False,"""An 'ethical code' provides a set of guidelines for ethical behavior, while a 'decision maker' performs the act of making decisions. They serve different primary functions."""
263,0,192,82,3,False,"""The methods and procedures in an 'ethical code' (ethical guidelines) differ significantly from those in a 'decision maker' (decision-making processes). They are not logically equivalent."""
264,0,192,82,4,False,"""An 'ethical code' is a set of written rules, whereas a 'decision maker' is an individual making decisions. They are not physically interchangeable."""
265,0,142,244,1,False,"Artificial intelligence is a field that studies sense-making and decision making in software, while Bayesian inference is a process within decision-making emphasizing updating beliefs based on evidence. They express different concepts and are not substitutable in a conceptual architecture without changing the meaning."
266,0,142,244,2,False,"Artificial intelligence performs broader functions in decision-making and sense-making, whereas Bayesian inference specifically updates beliefs based on evidence. They serve different primary functions and are not functionally equivalent."
267,0,142,244,3,False,"The methods and procedures in artificial intelligence (algorithms, models for sense-making, and decision-making) differ significantly from those in Bayesian inference (updating beliefs using Bayes' theorem and evidence). They are not logically equivalent."
268,0,142,244,4,False,"Artificial intelligence as a field of study and Bayesian inference as a specific statistical technique are not physically interchangeable. Artificial intelligence encompasses various technologies and approaches, while Bayesian inference is a specific methodology."
269,0,57,29,0,False,"""A facilitator guides a process, whereas majority rule is a decision-making process. They express different concepts."""
270,0,57,29,1,False,"""A facilitator performs the function of guiding a process, while majority rule performs the function of making decisions based on the majority. Different functions."""
271,0,57,29,2,False,"""The methods and procedures of a facilitator (guiding a process) differ from those involved in majority rule (counting votes). Not logically equivalent."""
272,0,57,29,3,False,"""A facilitator is an individual guiding a process, while majority rule is a decision-making mechanism. They are not physically interchangeable."""
273,0,38,235,1,False,"Consensus is a general agreement among participants, while the PDCA cycle is a structured decision-making process emphasizing plan, do, check, and act."
274,0,38,235,2,False,"Consensus achieves agreement, whereas PDCA involves iterative steps to improve processes. They perform different functions."
275,0,38,235,3,False,"Consensus is a concept of agreement, while PDCA outlines specific steps (plan, do, check, act) for process improvement. Different methods and procedures."
276,0,38,235,4,False,"Consensus is an abstract concept, whereas PDCA is a concrete, cyclical process for continuous improvement. Not physically interchangeable."
277,0,26,62,1,False,"A ""code of conduct"" is a set of rules for behavior in a community, while a ""secretary"" is a person who records information. These concepts are different."
278,0,26,62,2,False,"A ""code of conduct"" provides behavioral guidelines, whereas a ""secretary"" performs the function of recording information. Different functions."
279,0,26,62,3,False,"The methods and procedures for defining a ""code of conduct"" differ from the duties performed by a ""secretary"" (recording information). Not logically equivalent."
280,0,26,62,4,False,"A ""code of conduct"" is a set of rules, whereas a ""secretary"" is a person performing a role. These are not physically interchangeable."
281,0,167,130,1,False,The concept of supervision (overseeing others) is different from a system dynamics model (representation of a system). They express different concepts in a conceptual architecture.
282,0,167,130,2,False,"Supervision performs the function of overseeing others, while a system dynamics model is used to represent and study system behaviors. They perform different functions and are not functionally equivalent."
283,0,167,130,3,False,"Supervision involves the methods and procedures for overseeing individuals, whereas system dynamics modeling employs specific techniques for system simulation and analysis. They are not logically equivalent."
284,0,167,130,4,False,"Supervision is an activity carried out by individuals, while a system dynamics model is typically represented through diagrams or computer-based models. They are not physically interchangeable."
285,1,248,208,1,False,"""Dynamic programming is a decision-making process that breaks a problem into subproblems, whereas knowledge representation is a process for representing knowledge. They express different concepts in a conceptual architecture."""
286,1,248,208,2,False,"""Dynamic programming performs the function of breaking problems into subproblems, while knowledge representation focuses on representing knowledge. They serve different functions and are not functionally equivalent."""
287,1,248,208,3,False,"""The procedures and methods in dynamic programming (breakdown of problems) differ significantly from those in knowledge representation (techniques for representing knowledge). They are not logically equivalent."""
288,1,248,208,4,False,"""Dynamic programming involves computational techniques for decision processes, whereas knowledge representation involves techniques for encoding and structuring knowledge. They are not physically interchangeable."""
289,0,2,261,1,False,"""Least squares regression is a statistical method for estimating relationships, whereas the Cynefin framework is a decision-making framework that emphasizes complexity management. They express different concepts in a conceptual architecture."""
290,0,2,261,2,False,"""Least squares regression performs the function of estimating relationships in data, while the Cynefin framework helps identify decision contexts based on complexity and guides appropriate responses. They serve different primary functions."""
291,0,2,261,3,False,"""The procedures and methods in least squares regression (statistical calculations) differ significantly from those in the Cynefin framework (identifying contexts and decision-making techniques for different complexity domains). They are not logically equivalent."""
292,0,2,261,4,False,"""Least squares regression is a mathematical technique for model estimation, whereas the Cynefin framework is a conceptual tool for decision-making across various contexts. They are not physically interchangeable."""
293,0,246,29,1,False,"""Forecasting is a decision-making process that emphasizes predicting future outcomes, while majority rule is a decision-making process that emphasizes the majority. They express different concepts and are not substitutable in a conceptual architecture without changing the meaning."""
294,0,246,29,2,False,"""Forecasting serves to predict future outcomes based on data and trends, whereas majority rule serves to make decisions based on the majority vote. They perform different functions and are not functionally equivalent."""
295,0,246,29,3,False,"""The procedures and methods in forecasting (analyzing data and trends) differ significantly from those in majority rule (counting votes and making decisions based on the majority). They are not logically equivalent."""
296,0,246,29,4,False,"""Forecasting involves techniques like statistical analysis and trend estimation, while majority rule involves vote counting and decision mechanisms. They are not physically interchangeable."""
297,0,266,220,1,False,"""Pareto efficiency and knowledge express different concepts. One is a decision-making process, the other is interpreted information."""
298,0,266,220,2,False,"""Pareto efficiency functions to balance decision-making factors, while knowledge pertains to interpreted information. They perform different functions."""
299,0,266,220,3,False,"""The methods and procedures to achieve Pareto efficiency differ significantly from those for interpreting information into knowledge. They are not logically equivalent."""
300,0,266,220,4,False,"""Pareto efficiency is a process employed in decision-making, while knowledge is an interpreted form of information. They are not interchangeable physically."""
301,0,185,75,1,False,"""A code of ethics outlines rules for ethical behavior, whereas a relationship is a connection between objects. They express different concepts and cannot be substituted in a conceptual architecture without changing the meaning."""
302,0,39,169,1,False,"""A consensus protocol is a set of rules for reaching agreement, whereas monitoring is the process of observing and recording. They express different concepts and cannot be substituted in a conceptual architecture without changing the architecture."""
303,0,39,169,2,False,"""A consensus protocol functions to facilitate agreement among participants, while monitoring serves to observe and record processes. They perform different functions and are not functionally equivalent."""
304,0,39,169,3,False,"""The methods and procedures involved in implementing a consensus protocol (rules for reaching agreement) are quite distinct from those involved in monitoring (observing and recording processes). Thus, they are not logically equivalent."""
305,0,39,169,4,False,"""Physically, a consensus protocol is a set of rules that guide agreements, while monitoring involves tools and methods for observing and recording. They are not physically interchangeable."""
306,0,136,94,1,False,"Political science is an academic field that studies political systems, whereas mediation is a process specifically aimed at resolving disputes. These objects express different concepts."
307,0,136,94,2,False,"Political science functions to provide insights and understanding of political systems, while mediation functions to resolve disputes through negotiation and dialogue. Different functions."
308,0,136,94,3,False,"The methods and procedures used in political science (theoretical analysis, research) differ significantly from those in mediation (negotiation techniques, facilitating agreements). Not logically equivalent."
309,0,136,94,4,False,Political science and mediation are not the same in a concrete sense; one is an academic field and the other is a process. They are not physically interchangeable.
310,0,123,251,1,False,"""An information system manages information, while a committee is a group of people who make decisions. They express different concepts in a conceptual architecture."""
311,0,123,251,2,False,"""An information system performs the function of managing information, while a committee functions to make decisions. They serve different primary functions."""
312,0,123,251,3,False,"""The procedures and methods used in an information system (handling data, processing, storage) are different from those in a committee (collective decision-making). Not logically equivalent."""
313,0,123,251,4,False,"""Physically, an information system consists of hardware and software, while a committee consists of people. They are not physically interchangeable."""
314,0,36,210,1,False,"""A hard fork is a process involving backward-incompatible protocol changes, while infrastructure is a set of resources supporting a system. They express different concepts in a conceptual architecture."""
315,0,36,210,2,False,"""Hard fork serves to change protocol, effectively impacting the system's operations, while infrastructure serves to support the system. They perform different functions and are not functionally equivalent."""
316,0,36,210,3,False,"""The procedures involved in implementing a hard fork (altering the protocol) differ significantly from those in maintaining infrastructure (resource management and support). Thus, they are not logically equivalent."""
317,0,36,210,4,False,"""A hard fork involves changes within a blockchain protocol, while infrastructure consists of the physical and digital resources that support a system. They are not physically interchangeable."""
318,1,49,230,1,False,"A follower is a person who follows a leader, whereas a library card is a reference to a library patron. These concepts are distinct."
319,1,49,230,2,False,"The function of a follower is to follow a leader, while a library card functions as a reference for identifying library patrons. Different functions."
320,1,49,230,3,False,The methods and procedures involved in following a leader differ from the cataloging and issuing processes of a library card. Not logically equivalent.
321,1,49,230,4,False,"A follower is a person, while a library card is a physical reference. They are not physically interchangeable."
322,0,181,256,1,False,"""Terms of service are a legal agreement for using a service, while an advisory board is a group of people who provide guidance. These objects express different concepts and are not substitutable in a conceptual architecture without changing the architecture."""
323,0,181,256,2,False,"""Terms of service function as a legal agreement governing the use of a service, whereas an advisory board functions to provide guidance and advice. They perform different primary functions."""
324,0,181,256,3,False,"""The methods and procedures for drafting and enforcing terms of service (legal agreements) differ significantly from those involved in the operations of an advisory board (providing guidance and advice). They are not logically equivalent."""
325,0,181,256,4,False,"""Physically, terms of service is a legal document, while an advisory board comprises individuals who provide guidance. They are not physically interchangeable."""
326,0,143,167,1,False,"""Machine learning is a field that focuses on how computers draw inferences from data, whereas supervision involves overseeing others, two distinctly different concepts."""
327,0,115,206,1,False,"""A decision-making tool aids in making decisions, while information organization is a process for organizing information. These concepts are distinct and cannot be substituted in a conceptual architecture without changing the meaning."""
328,0,115,206,2,False,"""A decision-making tool performs the function of facilitating decision-making, while information organization functions to structure and categorize information. They perform different primary functions."""
329,0,115,206,3,False,"""The methods and procedures in using a decision-making tool (software algorithms, interactive tools) differ significantly from those in information organization (cataloging methods, data structuring techniques). They are not logically equivalent."""
330,0,115,206,4,False,"""A decision-making tool is often a software application or tool designed to assist in decision-making, whereas information organization involves processes and techniques for categorizing and maintaining information. They are not physically interchangeable."""
331,0,198,195,1,False,"""Secondary rules refer to meta-rules governing how other rules are created, which is conceptually different from bylaws that are specific rules for an organization."""
332,0,198,195,2,False,"""Secondary rules perform the function of providing guidelines for rule-making, whereas bylaws function to guide organizational behavior. They serve different primary functions."""
333,0,198,195,3,False,"""The procedures involved in formulating secondary rules (meta-rule creation) are different from those involved in creating bylaws (rules for organizational behavior). They are not logically equivalent."""
334,0,198,195,4,False,"""Secondary rules are abstract and broader in scope, whereas bylaws are concrete rules specific to an organization. They are not physically interchangeable."""
335,0,157,208,1,False,"""Voronoi partitioning is a method for geometrically partitioning a plane into regions, whereas knowledge representation is a process for structuring and encoding knowledge. They express different concepts and cannot be substituted in a conceptual architecture without altering the system."""
336,0,157,208,2,False,"""Voronoi partitioning performs the function of dividing spaces, whereas knowledge representation structures knowledge. They serve different primary functions in their respective domains."""
337,0,157,208,3,False,"""The methods and procedures used in Voronoi partitioning (geometric and spatial techniques) differ significantly from those in knowledge representation (encoding and organizing information). They are not logically equivalent."""
338,0,157,208,4,False,"""Voronoi partitioning involves geometric computations and structures, while knowledge representation involves symbolic or logical structures. They are not physically interchangeable."""
339,0,104,90,1,False,"""Strategies refer to a set of plans for achieving goals, whereas an operational model represents a system as a set of procedures or decision rules. They express different concepts."""
340,0,104,90,2,False,"""Strategies perform the function of planning for achieving goals, while an operational model functions to represent a system's operations through procedures and rules. They serve different primary functions."""
341,0,104,90,3,False,"""The methods and procedures for devising strategies differ significantly from those in creating an operational model (procedures and decision rules). They are not logically equivalent."""
342,0,104,90,4,False,"""Strategies are a set of plans, which are conceptual tools, whereas an operational model is a detailed representation of procedures and decision rules. They are not physically interchangeable."""
343,0,173,95,1,False,"Feedback and expectations express different concepts: feedback provides information as input for a process, while expectations refer to anticipated outcomes."
344,0,173,95,2,False,"Feedback and expectations serve different functions: feedback is used to regulate and inform processes, whereas expectations guide anticipated future states."
345,0,173,95,3,False,The methods and procedures involved in generating feedback (collecting and providing process input) differ from those establishing expectations (forecasting).
346,0,173,95,4,False,"Feedback, as information within a process, and expectations, as anticipated outcomes, are not physically interchangeable."
347,1,137,254,1,False,"""Social science is a field that studies human behavior, while a task force is a group of people who work on a specific task. They express different concepts."""
348,1,137,254,2,False,"""Social science performs the function of studying human behavior, whereas a task force works to complete specific tasks. They serve different functions."""
349,1,137,254,3,False,"""The methods and procedures in social science (research and analysis of human behavior) differ greatly from those used by a task force (collaborative task completion)."""
350,1,137,254,4,False,"""Social science is an academic field of study, whereas a task force is a group of people with a specific objective. They are not physically interchangeable."""
351,0,173,90,1,False,"Feedback provides information about a process input to itself, while a narrative model represents a system as a story or demonstration. They express different concepts."
352,1,173,90,2,False,"Feedback functions to regulate processes by providing internal information, while a narrative model's function is to represent systems through stories. Different functions."
353,2,173,90,3,False,The procedures and methods involved in creating feedback loops differ significantly from those used to develop narrative models. They are not logically equivalent.
354,3,173,90,4,False,"Feedback in systems is information-based, and narrative models are often visual or descriptive representations. They are not physically interchangeable."
355,0,82,189,1,False,"""A 'decision maker' is a person who makes a decision, whereas 'source code' is a set of instructions in a programming language. They express different concepts and cannot be substituted in a conceptual architecture without changing the architecture."""
356,0,82,189,2,False,"""A 'decision maker' performs the function of making decisions, while 'source code' performs the function of instructing computational operations. They serve different primary functions."""
357,0,82,189,3,False,"""The procedures and methods involved in decision making (analysis, evaluation, and choice) differ significantly from those in writing and executing source code (coding, debugging, and compiling). They are not logically equivalent."""
358,0,82,189,4,False,"""A 'decision maker' is an individual making decisions, whereas 'source code' is a set of written instructions for computers. They are not physically interchangeable."""
359,1,154,12,1,False,"""Responsibility is a process where authority is carried out, whereas random forest is a method for making decisions based on a collection of trees. They express different concepts in a conceptual architecture."""
360,1,154,12,2,False,"""Responsibility involves the execution of duties related to authority, while random forest performs decision-making using multiple decision trees. They serve different functions."""
361,1,154,12,3,False,"""The procedures for exercising responsibility differ from those involved in creating and using random forests (which includes methods like bagging and the aggregation of decision trees). They are not logically equivalent."""
362,1,154,12,4,False,"""Responsibility is an abstract process related to carrying out authority, while random forest represents a computational method for decision-making. Therefore, they are not physically interchangeable."""
363,0,168,63,1,False,"""Management and decision express different concepts: management is the process of coordinating resources, while a decision is a course of action determined after consideration."""
364,0,168,63,2,False,"""Management performs the function of coordinating resources, whereas a decision performs the function of determining a course of action. They serve different primary functions."""
365,0,168,63,3,False,"""The methods and procedures in management (coordinating resources) differ significantly from those in making decisions (consideration and choice). They are not logically equivalent."""
366,0,168,63,4,False,"""Management involves the coordination of resources and often includes various procedures and actions, while a decision is a specific course of action. They are not physically interchangeable."""
367,0,167,230,1,False,"""Supervision refers to the process of overseeing others, whereas a library card is a reference to a library patron. These objects express different concepts and cannot be substituted in a conceptual architecture without changing the meaning."""
368,0,167,230,2,False,"""Supervision performs the function of managing and guiding others, whereas a library card functions to locate and reference library patrons. They serve different primary functions and are not functionally equivalent."""
369,0,167,230,3,False,"""The methods and procedures involved in supervising others (management practices, oversight techniques) differ significantly from those involved in cataloging and using library cards (library management, user identification). They are not logically equivalent."""
370,0,167,230,4,False,"""Supervision is an activity performed by individuals or roles within an organization, whereas a library card is a physical or digital reference object. They are not physically interchangeable."""
371,1,145,272,1,False,"**Artificial Intelligence** is a field of study concerning sense-making and decision-making in software, while **Hick's Law** is a principle emphasizing simplicity in decision-making processes. They represent different concepts in a conceptual architecture."
372,1,145,272,2,False,"**Artificial Intelligence** performs the broader function of developing systems that make decisions and give sense to data, whereas **Hick's Law** provides a principle emphasizing simplicity for decision speed. They have different functions."
373,1,145,272,3,False,"The procedures and methods used in **Artificial Intelligence** (algorithm development, data processing) are distinct from those in applying **Hick's Law** (simplifying choices to speed decision-making). Not logically equivalent."
374,1,145,272,4,False,**Artificial Intelligence** as a technological study and **Hick's Law** as a human decision-making principle are not physically interchangeable.
375,0,252,153,1,False,"""""""""A 'team' is a group of people who work together, whereas 'accountability' is a process where authority is enforced. They express different concepts."""""""""
376,0,252,153,2,False,"""""""""A 'team' performs the function of collaboration to achieve a task, while 'accountability' ensures that authority is properly executed. They serve different primary functions."""""""""
